vulnerability_group,biomarker,sl_target,mechanism,cohens_d,ci_lower,ci_upper,fdr,n_mutant_depmap,n_wt_depmap,drug,drug_status,breast_frequency_pct,estimated_patients_year,clinical_gap,source_atlas
MTAP-deleted,MTAP homozygous deletion (9p21),PRMT5,Methionine salvage pathway synthetic lethality,-1.72754962697287,-2.8313680348280763,-0.8971126265899112,0.0029565574371889,8.0,45.0,"PRMT5 inhibitors (GSK3326595, JNJ-64619178, PRT543)","Phase 1/2 clinical trials (heme/solid tumors, NO breast enrollment)",3.3,10163,STRONGEST PRMT5 SL of all cancer types. Zero breast cancer trials.,pancancer-mtap-prmt5-atlas
ARID1A-mutant,ARID1A loss-of-function mutation,HMGCR (HMG-CoA reductase),Cholesterol biosynthesis synthetic lethality via SWI/SNF loss,-1.6808740720265096,,,0.8776493075459502,5.0,48.0,"Statins (atorvastatin, simvastatin, rosuvastatin)",FDA-approved (hyperlipidemia). Repurposable for cancer.,4.2,13050,Statins are generic and immediately testable. No prospective ARID1A-stratified statin trials in breast.,arid1a-pancancer-sl-atlas
PIK3CA-mutant,"PIK3CA activating mutation (H1047R/L, E545K, E542K)",PIK3CA (PI3K pathway),Oncogene addiction / PI3K pathway dependency,-1.4489453566961252,-2.103398472933078,-0.7944922404591723,0.8028820202898049,17.0,32.0,"Inavolisib (GDC-0077), alpelisib (Piqray)",FDA-approved (inavolisib 2024 HR+/HER2- PIK3CA-mut breast; alpelisib 2019),32.6,79691,E545K allele shows 39% weaker inavolisib response — dose-optimization biomarker.,pik3ca-allele-dependencies
BRCA1/2-mutant,BRCA1 or BRCA2 pathogenic variant (germline or somatic),"PARP1/2 (primary); FA pathway, STING1/TBK1 (novel)",Homologous recombination deficiency synthetic lethality,-1.0,,,,,,"Olaparib (Lynparza), talazoparib (Talzenna)",FDA-approved (olaparib adjuvant HER2-neg gBRCA; talazoparib gBRCA),5.0,15536,"PARPi resistance affects 30-50%. Novel non-HR targets (FA, STING1/TBK1) may overcome resistance.",brca-pancancer-sl-atlas
TP53-WT,TP53 wild-type (no somatic TP53 mutation),MDM2 (MDM2-p53 axis),MDM2 overexpression dependency in TP53-WT tumors (reactivate p53),1.9154994378071344,1.7719762579934712,2.0590226176207977,3.3912426670252814e-87,795.0,391.0,"KT-253 (MDM2 PROTAC), milademetan, navtemadlin",Phase 1 clinical trials (KT-253 in AML/solid tumors),67.4,209425,Large TP53-WT population. MDM2i trials focused on heme. No breast-specific MDM2i trials.,tp53-hotspot-allele-dependencies
